<?xml version="1.0" encoding="UTF-8"?>
<!DOCTYPE synth SYSTEM "SynthME.dtd">

<synth>

    <style id="global">
      <state>
        <font name="PROPORTIONAL" size="MEDIUM"/>
        <color type="FOREGROUND" value="#52425c"/>
      </state>
    </style>
    <bind style="global" key=".*"/>

    <style id="tooltip">
      <state>
        <color type="BACKGROUND" value="#FF00FF"/>
      </state>
    </style>
    <bind style="tooltip" key="ToolTip"/>

    <style id="photoButton">
      <insets top="3" left="3" bottom="3" right="3"/>
      <state value="FOCUSED">
        <imagePainter path="/telus/ContactPictureHighlight.png" sourceInsets="20 20 20 20" paintCenter="false"/>
      </state>
    </style>
    <bind style="photoButton" key="PhotoButton"/>

    <style id="button">
      <insets top="3" left="3" bottom="3" right="3"/>
      <state value="FOCUSED">				<!-- top, left, bottom, right -->
        <imagePainter path="/telus/highlight.png" sourceInsets="14 10 6 10" paintCenter="false"/>
        <color type="BORDERFILL" value="#49266c"/>
        <color type="FOREGROUND" value="#FFFFFF"/>
      </state>
      <state value="DISABLED">
        <color type="FOREGROUND" value="#AAAAAA"/>
      </state>
    </style>
    <bind style="button" key="Button"/>
    <bind style="button" key="CheckBox"/>
    <bind style="button" key="RadioButton"/>
    <bind style="button" key="TextField"/>
    <bind style="button" key="TextArea"/>

    <style id="tabtop">
      <state>
        <imagePainter path="/telus/tab_top.png" sourceInsets="0 20 5 20" paintCenter="false"/>
      </state>
    </style>
    <bind style="tabtop" key="TabTop"/>


    <style id="tabRendererTop">
      <insets top="4" left="3" bottom="4" right="3"/>
      <state>
        <imagePainter path="/telus/Tab.png" sourceInsets="16 3 16 3" paintCenter="false"/>
        <color type="BORDERFILL" value="#4602bb"/>
      </state>
      <state value="SELECTED">
        <imagePainter path="/telus/Focus.png" sourceInsets="16 3 16 3" paintCenter="false"/>
        <color type="BORDERFILL" value="#6c18f4"/>
      </state>
    </style>
    <bind style="tabRendererTop" key="TabRendererTop"/>


    <style id="tabContentBottom">
      <insets top="0" left="2" bottom="5" right="4"/>
      <state>
        <imagePainter path="/telus/tab_bottom.png" sourceInsets="20 20 20 20" paintCenter="false"/>
        <color type="BORDERFILL" value="FFFFFF"/>
      </state>
    </style>
    <bind style="tabContentBottom" key="TabContentBottom"/>


    <style id="window">
      <insets top="0" left="0" bottom="0" right="0"/>
      <state>
        <imagePainter path="/telus/mainWindow.png" sourceInsets="25 115 25 115" paintCenter="false"/>
        <color type="BORDERFILL" value="#FFFFFF"/>
      </state>
    </style>
    <bind style="window" key="Window"/>


    <style id="textWindow">
      <insets top="0" left="0" bottom="0" right="0"/>
      <state>
        <imagePainter path="/telus/mainWindow.png" sourceInsets="25 115 25 115" paintCenter="false"/>
        <color type="BORDERFILL" value="#FFFFFF"/>
      </state>
    </style>
    <bind style="textWindow" key="TextWindow"/>


    <style id="menu">
      <insets top="5" left="5" bottom="5" right="5"/>
      <state>
        <imagePainter path="/telus/menu.png" sourceInsets="20 20 20 20" paintCenter="false"/>
        <color type="BORDERFILL" value="#FFFFFF"/>
      </state>
    </style>
    <bind style="menu" key="Menu"/>
    <bind style="menu" key="Dialog"/>


    <style id="softkeys">
      <imageIcon id="button_normal" path="/telus/mainWindow.png" x="120" y="0" width="120" height="25"/>
      <imageIcon id="bottom_right" path="/telus/mainWindow.png" x="120" y="25" width="120" height="25"/>
      <imageIcon id="bottom_left" path="/telus/mainWindow.png" x="0" y="25" width="120" height="25"/>
      <state>
        <property key="button" value="button_normal"/>
        <property key="bottomRight" value="bottom_right"/>
        <property key="bottomLeft" value="bottom_left"/>
      </state>
    </style>
    <bind style="softkeys" key="SoftkeyRenderer"/>


    <style id="checkbox">
      <imageIcon id="check_on" path="/telus/iconGrid.png" x="0" y="0" width="20" height="20"/>
      <imageIcon id="check_on_disabled" path="/telus/iconGrid.png" x="0" y="20" width="20" height="20"/>
      <imageIcon id="check_off" path="/telus/iconGrid.png" x="0" y="40" width="20" height="20"/>
      <imageIcon id="check_off_disabled" path="/telus/iconGrid.png" x="0" y="60" width="20" height="20"/>
      <state>
        <property key="icon" value="check_off"/>
      </state>
      <state value="SELECTED">
        <property key="icon" value="check_on"/>
      </state>
      <state value="DISABLED">
        <property key="icon" value="check_off_disabled"/>
      </state>
      <state value="DISABLED AND SELECTED">
        <property key="icon" value="check_on_disabled"/>
      </state>
    </style>
    <bind style="checkbox" key="CheckBox"/>


    <style id="radioButton">
      <imageIcon id="radio_on" path="/telus/iconGrid.png" x="0" y="80" width="20" height="20"/>
      <imageIcon id="radio_on_disabled" path="/telus/iconGrid.png" x="0" y="100" width="20" height="20"/>
      <imageIcon id="radio_off" path="/telus/iconGrid.png" x="0" y="120" width="20" height="20"/>
      <imageIcon id="radio_off_disabled" path="/telus/iconGrid.png" x="0" y="140" width="20" height="20"/>
      <state>
        <property key="icon" value="radio_off"/>
      </state>
      <state value="SELECTED">
        <property key="icon" value="radio_on"/>
      </state>
      <state value="DISABLED">
        <property key="icon" value="radio_off_disabled"/>
      </state>
      <state value="DISABLED AND SELECTED">
        <property key="icon" value="radio_on_disabled"/>
      </state>
    </style>
    <bind style="radioButton" key="RadioButton"/>



    <style id="scrollpane">
      <imageIcon id="thumb_top" path="/telus/ScrollbarThumb.png" x="0" y="0" width="7" height="7"/>
      <imageIcon id="thumb_fill" path="/telus/ScrollbarThumb.png" x="0" y="7" width="7" height="16"/>
      <imageIcon id="thumb_bottom" path="/telus/ScrollbarThumb.png" x="0" y="23" width="7" height="7"/>

      <imageIcon id="track_top" path="/telus/ScrollbarPole.png" x="0" y="0" width="9" height="2"/>
      <imageIcon id="track_fill" path="/telus/ScrollbarPole.png" x="0" y="2" width="9" height="36"/>
      <imageIcon id="track_bottom" path="/telus/ScrollbarPole.png" x="0" y="38" width="9" height="2"/>

      <imageIcon id="left_arrow" path="/telus/scrollArrows.png" x="0" y="0" width="15" height="30"/>
      <imageIcon id="right_arrow" path="/telus/scrollArrows.png" x="0" y="30" width="15" height="30"/>
      <state>
        <property key="thumbTop" value="thumb_top"/>
        <property key="thumbBottom" value="thumb_bottom"/>
        <property key="thumbFill" value="thumb_fill"/>
        <property key="trackTop" value="track_top"/>
        <property key="trackBottom" value="track_bottom"/>
        <property key="trackFill" value="track_fill"/>
        <property key="rightArrow" value="right_arrow"/>
        <property key="leftArrow" value="left_arrow"/>
      </state>
    </style>
    <bind style="scrollpane" key="ScrollPane"/>





    <style id="listRenderer">
      <insets top="3" left="3" bottom="3" right="3"/>
      <font id="font2" name="PROPORTIONAL" size="LARGE"/>
      <font id="font3" name="PROPORTIONAL" size="SMALL"/>
      <state>
        <property key="font2" value="font2"/>
        <property key="font3" value="font3"/>
      </state>
      <state value="SELECTED">
        <imagePainter path="/telus/highlight.png" sourceInsets="14 10 6 10" paintCenter="false"/>
        <color type="BORDERFILL" value="#49266c"/>
        <color type="FOREGROUND" value="#FFFFFF"/>
      </state>
    </style>
    <bind style="listRenderer" key="ListRenderer"/>


    <!-- This is a theme for a custome component -->
    <style id="contacts">
      <font id="focused_name" name="PROPORTIONAL" size="LARGE"/>
      <font id="focused_status" name="PROPORTIONAL" size="SMALL"/>
      <font id="normal_name" name="PROPORTIONAL" size="LARGE"/>
      <font id="normal_status" name="PROPORTIONAL" size="SMALL"/>
      <state>
        <imagePainter path="/telus/rowBackground.png" sourceInsets="15 0 15 0" paintCenter="true"/>
	<color id="color_focused_name" value="#FFFFFF"/>
	<color id="color_focused_status" value="#000000"/>
	<color id="color_normal_name" value="#FFFFFF"/>
	<color id="color_normal_status" value="#000000"/>
        <property key="fontName" value="normal_name"/>
        <property key="fontStatus" value="normal_status"/>
        <property key="colorName" value="color_focused_name"/>
        <property key="colorStatus" value="color_focused_status"/>
        <property key="height" type="integer" value="42"/>
      </state>
      <state value="FOCUSED">
        <imagePainter path="/telus/highlightRowBackground.png" sourceInsets="10 10 10 10" paintCenter="true"/>
        <property key="fontName" value="focused_name"/>
        <property key="fontStatus" value="focused_status"/>
        <property key="colorName" value="color_normal_name"/>
        <property key="colorStatus" value="color_normal_status"/>
        <property key="height" type="integer" value="62"/>
      </state>
    </style>
    <bind style="contacts" key="ContactsRenderer"/>
</synth>
